{
  "schemaVersion": "1",
  "id": "kya:skill:kya-design-system",
  "type": "skill",
  "name": "KYA Design System",
  "version": "0.1.0",
  "summary": "Official visual, interaction and governance rules for KYA-Platform experiences.",
  "owners": {
    "business": "communication",
    "technical": "cvsi-platform",
    "workspace": "kya-platform"
  },
  "source": {
    "repository": "https://github.com/Jean-claude21/kya-platform",
    "commit": "3031d8687c28bf12873c5f648cb629dfeceb78df",
    "path": "catalog/templates/skill/kya-design-system"
  },
  "integrity": {
    "algorithm": "sha256",
    "digest": "0000000000000000000000000000000000000000000000000000000000000000"
  },
  "compatibility": { "codex": ">=2026-09" },
  "dependencies": [],
  "scopes": ["skill.discover"],
  "risk": "read"
}
