{
  "schemaVersion": "1",
  "id": "kya:skill:kya-design-system",
  "type": "skill",
  "name": "KYA Design System",
  "version": "0.1.2",
  "summary": "Official visual, interaction and governance rules for KYA-Platform experiences.",
  "owners": {
    "business": "communication",
    "technical": "cvsi-platform",
    "workspace": "kya-platform"
  },
  "source": {
    "repository": "https://github.com/Jean-claude21/kya-platform",
    "commit": "3b7031f46f9260eb8fe692246d32d5d7a01fd8a0",
    "path": "catalog/templates/skill/kya-design-system"
  },
  "integrity": {
    "algorithm": "sha256",
    "digest": "8f692fb28d781a34dca8655bc1f779a6f42294d78df6cbe9eff0f7093f6f67d4"
  },
  "compatibility": {
    "codex": ">=2026-09",
    "claude-code": ">=2026-09",
    "portable-zip": ">=2026-09"
  },
  "dependencies": [],
  "scopes": [
    "skill.discover"
  ],
  "risk": "read"
}
